source,category,name,brand,url,postcode,lat,lon,phone,rating,price_level,business_status,opening_hours
exa,escape_rooms,London's best escape rooms - Time Out,,https://www.timeout.com/london/things-to-do/londons-best-escape-games,,,,,,,,
exa,escape_rooms,Thrilling Escape Rooms In London | Enigma Quests,,https://enigmaquests.london/escape-rooms/london/,,,,,,,,
exa,escape_rooms,Escape Rooms - Enigma Quests,,https://enigmaquests.london/escape-rooms/,,,,,,,,
exa,escape_rooms,Our Exciting Escape Rooms in Holborn | Book Online Now,,https://enigmaquests.london/escape-rooms/holborn/,,,,,,,,
exa,escape_rooms,Enigma Quests | Our Incredible Escape Rooms and Escape Arcade™,,https://enigmaquests.london/,,,,,,,,
exa,escape_rooms,Amazing Escape Rooms in London For Couples | A Date Night With ...,,https://enigmaquests.london/escape-rooms/for-couples/,,,,,,,,
exa,escape_rooms,Maximise Your Time in London With Our Amazing Escape Rooms,,https://enigmaquests.london/escape-rooms/for-tourists/time/,,,,,,,,
exa,escape_rooms,Escape Rooms Near Spitalfields | Three Thrilling Rooms Available,,https://enigmaquests.london/escape-rooms/spitalfields/,,,,,,,,
exa,escape_rooms,Brilliant Hen Party Escape Rooms in London | Enigma Quests,,https://enigmaquests.london/escape-rooms/escape-room-hen-party/,,,,,,,,
exa,escape_rooms,Escape Arcade™ - Enigma Quests,,https://enigmaquests.london/escape-arcade/,,,,,,,,
exa,laser_tag,Laser Mayhem: Laser Tag Essex & London,,https://www.lasermayhem.co.uk/,,,,,,,,
exa,laser_tag,Home - Laser Quest GB,,https://laserquest.co.uk/,,,,,,,,
exa,laser_tag,Locations - Laser Quest GB,,https://laserquest.co.uk/locations/,,,,,,,,
exa,laser_tag,Highly Exciting Realistic Outdoor Laser Tag Action - Laser Mayhem,,https://www.lasermayhem.co.uk/about/outdoor-laser-tag,,,,,,,,
exa,laser_tag,Laser Mayhem's Warehouse indoor playing field at Laser Tag London,,https://www.lasermayhem.co.uk/scenarios/laser-barn,,,,,,,,
exa,laser_tag,Black Hawk Down awesome themed laser tag field at quaser London,,https://www.lasermayhem.co.uk/scenarios/black-hawk-down,,,,,,,,
exa,laser_tag,Outdoor Laser tag mayhem is the best venue for Quazer in London,,https://www.lasermayhem.co.uk/about,,,,,,,,
exa,laser_tag,Why you should choose us? - Laser Mayhem,,https://www.lasermayhem.co.uk/about/why-us,,,,,,,,
exa,laser_tag,Off-site Games - Laser Mayhem,,https://www.lasermayhem.co.uk/offsite-games,,,,,,,,
exa,laser_tag,Laser Mayhem London the ideal place to take the kids this holiday,,https://www.lasermayhem.co.uk/events/holiday-games,,,,,,,,
exa,mini_golf,10 Best Crazy Golf Courses In London - DesignMyNight,,https://www.designmynight.com/london/crazy-golf-london,,,,,,,,
exa,mini_golf,The best crazy golf in London - Time Out,,https://www.timeout.com/london/things-to-do/the-best-crazy-golf-london-has-to-offer,,,,,,,,
exa,mini_golf,"CAMDEN CRAZY GOLF | Mini Golf | Dates, birthdays, parties",,https://www.junkyardgolfclub.co.uk/london-camden/,,,,,,,,
exa,mini_golf,"Puttshack | Upscale, Tech-Infused Mini Golf Experience",,https://www.puttshack.com/,,,,,,,,
exa,mini_golf,Puttshack Bank | Best Mini Golf in London,,https://www.puttshack.com/uk/locations/bank/,,,,,,,,
exa,mini_golf,"High Tech Mini Golf in London, Essex & USA | Crazy Golf - Puttshack",,https://www.puttshack.com/uk/,,,,,,,,
exa,mini_golf,"SHOREDITCH CRAZY GOLF | Mini Golf | Dates, birthdays, parties",,https://www.junkyardgolfclub.co.uk/london-shoreditch/,,,,,,,,
exa,mini_golf,Puttshack White City| Best Mini Golf in London,,https://www.puttshack.com/uk/locations/white-city/,,,,,,,,
exa,mini_golf,Puttshack Bank | Best Mini Golf in London | Crazy Golf  London,,https://www.puttshack.com/locations/bank,,,,,,,,
exa,mini_golf,Birdies Crazy Golf London,,https://www.playbirdies.com/,,,,,,,,
exa,climbing,The best rock climbing walls in London - Time Out,,https://www.timeout.com/london/things-to-do/the-best-climbing-walls-in-london,,,,,,,,
exa,climbing,"The Reach Climbing Wall | Sport and fitness in Charlton, London",,https://www.timeout.com/london/sport-and-fitness/the-reach-climbing-wall,,,,,,,,
exa,climbing,VauxWall West Climbing Centre | Sport and fitness in ... - Time Out,,https://www.timeout.com/london/sport-and-fitness/vauxwall-west-climbing-centre,,,,,,,,
exa,climbing,Castle Climbing Centre,,https://www.timeout.com/london/sport-and-fitness/castle-climbing-centre,,,,,,,,
exa,climbing,Westway Climbing Centre,,https://www.timeout.com/london/sport-fitness/westway-climbing-centre,,,,,,,,
exa,climbing,The Climbing Hangar,,https://www.timeout.com/london/sport-and-fitness/the-climbing-hangar,,,,,,,,
exa,climbing,"Rise Climbing | Things to do in Canning Town, London",,https://www.timeout.com/london/things-to-do/rise-climbing,,,,,,,,
exa,climbing,Climbing courses - The Castle Climbing Centre,,https://www.castle-climbing.co.uk/climbing-courses,,,,,,,,
exa,climbing,The Arch Climbing Wall North,,https://www.timeout.com/london/sport-and-fitness/the-arch-climbing-wall-north,,,,,,,,
exa,climbing,Welcome to climbing - The Castle Climbing Centre - The Castle ...,,https://www.castle-climbing.co.uk/,,,,,,,,
exa,bowling,The 7 best tenpin bowling alleys in London - Time Out,,https://www.timeout.com/london/things-to-do/londons-best-ten-pin-bowling-alleys,,,,,,,,
exa,bowling,Tenpin Acton | Bowling London | Best Bowling Party Fun!,,https://www.tenpin.co.uk/our-locations/acton/bowling/,,,,,,,,
exa,bowling,VIP Lanes - Queens London,,https://queens.london/bowling/vip-lanes/,,,,,,,,
exa,bowling,Bowling - All Star Lanes,,https://www.allstarlanes.co.uk/play/bowling,,,,,,,,
exa,bowling,Ten Pin Bowling Near Me | Hollywood Bowl,,https://www.hollywoodbowl.co.uk/centres,,,,,,,,
exa,bowling,Main Lanes - Queens London,,https://queens.london/bowling/main-lanes/,,,,,,,,
exa,bowling,Bowling - Queens London,,https://queens.london/bowling/,,,,,,,,
exa,bowling,Bowling London | Hollywood Bowl,,https://www.hollywoodbowl.co.uk/centres/greater-london-region,,,,,,,,
exa,bowling,Bowling London (At The O2) | Ten Pin Greenwich,,https://www.hollywoodbowl.co.uk/london-o2,,,,,,,,
exa,bowling,Hire Bowling Alley Venue London - Private Hire at The O2 London,,https://www.hollywoodbowl.co.uk/london-o2/exclusive-hire,,,,,,,,
exa,trampoline,Flip Out - The UK's Leading Adventure & Trampoline Parks,,https://www.flipout.co.uk/,,,,,,,,
exa,trampoline,London E6's Best Indoor Trampoline & Adventure Park! - Flip Out,,https://www.flipout.co.uk/locations/london-e6,,,,,,,,
exa,trampoline,Brent Cross' Best Indoor Trampoline & Adventure Park! - Flip Out,,https://www.flipout.co.uk/locations/brent-cross,,,,,,,,
exa,trampoline,Canary Wharf's Biggest & Best Indoor Adventure Park! - Flip Out,,https://www.flipout.co.uk/locations/canary-wharf,,,,,,,,
exa,trampoline,Indoor Trampoline Park in Acton - Oxygen Activeplay,,https://oxygenfreejumping.co.uk/locations/acton/,,,,,,,,
exa,trampoline,Oxygen Activeplay: #1 Big-Time Fun Indoor Activity Park,,http://oxygenfreejumping.co.uk/,,,,,,,,
exa,trampoline,Croydon's Best Indoor Adventure Park at Flip Out London,,https://www.flipout.co.uk/locations/croydon,,,,,,,,
exa,trampoline,"Open Play | Indoor Trampoline Park | Croydon, London",,https://oxygenfreejumping.co.uk/locations/croydon/freejumping/,,,,,,,,
exa,trampoline,About Flip Out Adventure & Trampoline Parks,,https://www.flipout.co.uk/about-flip-out,,,,,,,,
exa,trampoline,"Open Play | Indoor Trampoline Park | The O2, Greenwich",,https://oxygenfreejumping.co.uk/locations/the-o2-greenwich-london/freejumping,,,,,,,,
exa,vr_arcade,DNA VR First Virtual Reality Arcade Experience,,https://www.dnavr.co.uk/,,,,,,,,
exa,vr_arcade,Luxury VR Experience in London & beyond | OTHERWORLD,,https://www.other.world/,,,,,,,,
exa,vr_arcade,VR games and experiences in London near me DNA VR,,https://www.dnavr.co.uk/london/games/,,,,,,,,
exa,vr_arcade,DNA VR ⭐ First Virtual Reality Arcade Experience in London,,https://www.dnavr.co.uk/london/,,,,,,,,
exa,vr_arcade,DNA VR Price list in London,,https://www.dnavr.co.uk/london/prices/,,,,,,,,
exa,vr_arcade,FAQ ⭐ DNA VR,,https://www.dnavr.co.uk/faq/,,,,,,,,
exa,vr_arcade,Hammersmith - London ⭐ DNA VR,,https://www.dnavr.co.uk/contacts/vr-in-hammersmith/,,,,,,,,
exa,vr_arcade,Cyberpunk ⭐ Futuristic VR Adventure at DNA VR,,https://www.dnavr.co.uk/games/cyberpunk/,,,,,,,,
exa,vr_arcade,Virtual Reality in Victoria | OTHERWORLD,,https://www.other.world/london/victoria,,,,,,,,
exa,vr_arcade,Sandbox VR London | Immersive Virtual Reality Experiences,,https://sandboxvr.com/london,,,,,,,,
exa,ice_skating,Best places to go ice skating in London this winter - Time Out,,https://www.timeout.com/london/things-to-do/ice-skating-in-london,,,,,,,,
exa,ice_skating,"Ice Skating @ Ally Pally, London",,https://www.alexandrapalace.com/the-ice-rink/book-a-skate/,,,,,,,,
exa,ice_skating,Skate at Somerset House: tickets and info for Christmas 2025,,https://www.timeout.com/london/things-to-do/skate-at-somerset-house-1,,,,,,,,
exa,ice_skating,Canary Wharf Ice Rink is back for a mega 18 weeks of skating,,https://www.timeout.com/london/things-to-do/canary-wharf-ice-rink,,,,,,,,
exa,ice_skating,Where To Go Ice Skating In London This Winter 2025 - DesignMyNight,,https://www.designmynight.com/london/blog/ice-skating-london,,,,,,,,
exa,ice_skating,Learn to Ice Skate at Your Ally Pally,,https://www.alexandrapalace.com/the-ice-rink/learn-to-skate/,,,,,,,,
exa,ice_skating,It's official: Europe's most popular ice rink is in London - Time Out,,https://www.timeout.com/london/news/its-official-europes-most-popular-ice-rink-is-in-london-121624,,,,,,,,
exa,ice_skating,Westfield London Ice Rink | Things to do in London - Time Out,,https://www.timeout.com/london/things-to-do/westfield-london-ice-rink-1,,,,,,,,
exa,ice_skating,Alexandra Palace Ice Rink - London - Time Out,,https://www.timeout.com/london/things-to-do/alexandra-palace-ice-rink,,,,,,,,
exa,ice_skating,Ice Discos - Alexandra Palace,,https://www.alexandrapalace.com/whats-on/ice-discos/,,,,,,,,
exa,karting,"Go Karting London, Central London, Canary Wharf - K1 Speed",,https://www.capitalkarts.com/,,,,,,,,
exa,karting,Go Karting London | 5 London Indoor Tracks - TeamSport,,https://www.team-sport.co.uk/go-karting-london,,,,,,,,
exa,karting,Go Karting at TeamSport | #1 For Indoor Karting Nationwide,,https://www.team-sport.co.uk/,,,,,,,,
exa,karting,Revolution Karting – London's Place to Race,,https://revolutionkarting.com/,,,,,,,,
exa,karting,"Go Karting in Acton, West London - TeamSport",,https://www.team-sport.co.uk/go-kart-tracks/acton,,,,,,,,
exa,karting,Go Karting South East London | Docklands - TeamSport,,https://www.team-sport.co.uk/go-kart-tracks/docklands,,,,,,,,
exa,karting,Go Karting Edmonton | North London - TeamSport,,https://www.team-sport.co.uk/go-kart-tracks/edmonton-north-london,,,,,,,,
exa,karting,Go Karting Brent Cross (North West London) - TeamSport,,https://www.team-sport.co.uk/go-kart-tracks/brent-cross,,,,,,,,
exa,karting,Go Karting Mitcham (South London) - TeamSport,,https://www.team-sport.co.uk/go-kart-tracks/mitcham-south-london,,,,,,,,
exa,karting,"Kids Go Karting London | #1 Kids Go Karting Track, Canary Wharf, London",,https://www.capitalkarts.com/canary-wharf/kids-go-karting/,,,,,,,,
exa,paintball,Paintballing London | England,,https://www.paintballgames.co.uk/paintballing-london/,,,,,,,,
exa,paintball,"Paintballing in North, South, East & West London | Delta Force",,https://www.paintballgames.co.uk/delta-force-paintball-london-centres-north-southeast-and-west/,,,,,,,,
exa,paintball,Paintballing South London | Delta Force Paintball,,https://www.paintballgames.co.uk/centre/south-london-paintball/,,,,,,,,
exa,paintball,South London - Paintball - Best UK paintballer games | Delta Force,,https://www.paintballgames.co.uk/centre/south-london-effingham-paintball/,,,,,,,,
exa,paintball,Paintball North West London - Best UK paintballer games | Delta Force,,https://www.paintballgames.co.uk/centre/north-west-london-paintball/,,,,,,,,
exa,paintball,Paintball South London: Featuring Space Warz Paintballing Themes,,https://www.paintballgames.co.uk/delta-force-paintball-south-london-featuring-space-warz/,,,,,,,,
exa,paintball,South London – Orpington Paintball,,https://www.paintballgames.co.uk/centre/orpington-paintball/,,,,,,,,
exa,paintball,East London: play paintball in the city | Delta Force Paintball,,https://www.paintballgames.co.uk/delta-force-paintball-east-london-play-paintball-city/,,,,,,,,
exa,paintball,East London Paintball | Epic UK Paintball Days Out | Delta Force,,https://www.paintballgames.co.uk/centre/east-london-paintball/,,,,,,,,
exa,paintball,Paintballing Berkshire | Maidenhead Paintballing | Delta Force,,https://www.paintballgames.co.uk/centre/west-london-paintball/,,,,,,,,
exa,soft_play,The best soft-play centres in London - Time Out,,https://www.timeout.com/london/kids/the-best-soft-play-centres-in-london,,,,,,,,
exa,soft_play,"Gambado | Kids in Fulham, London - Time Out",,https://www.timeout.com/london/kids/gambado,,,,,,,,
exa,soft_play,"Ding Dong Fun Bus | Attractions in Tottenham, London - Time Out",,https://www.timeout.com/london/attractions/ding-dong-fun-bus,,,,,,,,
exa,soft_play,"Kidspace | Kids in Borough of Croydon, London - Time Out",,https://www.timeout.com/london/kids/kidspace,,,,,,,,
exa,soft_play,Dopamine Land: immersive playground for all ages - Time Out,,https://www.timeout.com/london/things-to-do/dopamine-land-review,,,,,,,,
exa,soft_play,Under 1 Roof Kids,,https://www.timeout.com/london/kids/under-1-roof-kids,,,,,,,,
exa,soft_play,"Inflata Nation Colindale (London) | Things to do in Borough of Brent, London",,https://www.timeout.com/london/things-to-do/inflata-nation-colindale-london,,,,,,,,
exa,soft_play,It’s a Kid’s Thing,,https://www.timeout.com/london/kids/play-space/its-a-kids-thing,,,,,,,,
exa,soft_play,Kidspace,,https://www.timeout.com/london/kids/play-space/kidspace,,,,,,,,
exa,soft_play,Kidzmania,,https://www.timeout.com/london/things-to-do/kidzmania,,,,,,,,
exa,indoor_skydiving,iFLY indoor skydiving has arrived in London - Time Out,,https://www.timeout.com/london/things-to-do/https-www-timeout-com-london-things-to-do-iflyindoorskydiving,,,,,,,,
exa,indoor_skydiving,"Inflata Nation Colindale (London) | Things to do in Borough of Brent, London",,https://www.timeout.com/london/things-to-do/inflata-nation-colindale-london,,,,,,,,
exa,indoor_skydiving,iFLY Indoor Skydiving for Two - Time Out london Offers,,https://checkout.timeout.com/london/ifly-indoor-skydiving-for-two-57367/,,,,,,,,
exa,indoor_skydiving,50% off iFLY indoor skydiving for two - Time Out london Offers,,https://checkout.timeout.com/london/50-off-ifly-indoor-skydiving-for-two-58744/,,,,,,,,
exa,indoor_skydiving,Exclusive tickets for indoor skydiving - Time Out london Offers,,https://checkout.timeout.com/london/exclusive-tickets-for-indoor-skydiving-57284,,,,,,,,
exa,indoor_skydiving,"We tried indoor skydiving at iFLY in Penrith, Sydney - Time Out",,https://www.timeout.com/sydney/things-to-do/ifly,,,,,,,,
exa,indoor_skydiving,This new indoor skydiving space is a must for thrill seekers,,https://www.timeout.com/new-york-kids/news/this-new-indoor-skydiving-space-is-a-must-for-thrill-seekers-041018,,,,,,,,
exa,indoor_skydiving,Oxygen Freejumping,,https://www.timeout.com/london/things-to-do/oxygen-freejumping,,,,,,,,
exa,indoor_skydiving,Ten ways for kids to fly in London - Time Out,,https://www.timeout.com/london/kids/ten-ways-for-kids-to-fly-in-london,,,,,,,,
exa,indoor_skydiving,"The O2, London: Tickets, Opening Hours and Visitor Info - Time Out",,https://www.timeout.com/london/music/the-o2,,,,,,,,
exa,axe_throwing,Where To Find The Best Axe Throwing In London - DesignMyNight,,https://www.designmynight.com/london/blog/axe-throwing-london,,,,,,,,
exa,axe_throwing,Game Of Throwing: Axe Throwing In London | DesignMyNight,,https://www.designmynight.com/london/event-space/hammersmith/game-of-throwing,,,,,,,,
exa,axe_throwing,Our Review Of Whistle Punks Axe Throwing In London,,https://www.designmynight.com/london/blog/whistle-punks-vauxhall-review,,,,,,,,
exa,axe_throwing,"Whistle Punks Axe Throwing | Things to do in Vauxhall, London",,https://www.timeout.com/london/things-to-do/whistle-punks-axe-throwing,,,,,,,,
exa,axe_throwing,Somebody is opening a massive axe-throwing bar on Oxford Street,,https://www.timeout.com/london/news/somebody-is-opening-a-massive-axe-throwing-bar-on-oxford-street-062521,,,,,,,,
exa,axe_throwing,Europe's biggest axe-throwing space is coming to Oxford Circus,,https://www.timeout.com/london/news/europes-biggest-axe-throwing-space-is-coming-to-oxford-circus-071322,,,,,,,,
exa,axe_throwing,Boom Battle Bar Wandsworth,,https://www.designmynight.com/london/bars/wandsworth/boom-battle-bar-wandsworth,,,,,,,,
exa,axe_throwing,Boom Battle Bar Oxford Street,,https://www.designmynight.com/london/bars/central-london/boom-battle-bar-oxford-street,,,,,,,,
exa,axe_throwing,Vinegar Yard,,https://www.designmynight.com/london/event-space/london-bridge/vinegar-yard,,,,,,,,
exa,axe_throwing,The London Fields,,https://www.designmynight.com/london/bars/hackney/the-london-fields,,,,,,,,
exa,arcade_bar,8 Best Arcades In London | DesignMyNight,,https://www.designmynight.com/london/best-arcades-in-london,,,,,,,,
exa,arcade_bar,NQ64 Soho: Quirky Arcade Bar In Central London | DesignMyNight,,https://www.designmynight.com/london/bars/soho/nq64-soho,,,,,,,,
exa,arcade_bar,"NQ64 | Things to do in Soho, London",,https://www.timeout.com/london/things-to-do/nq64,,,,,,,,
exa,arcade_bar,Retro Games & Themed Cocktails: Meet The Neon-Splattered Arcade Bar Heading To Soho,,https://www.designmynight.com/london/bars/nq64-soho/new-bar-spy,,,,,,,,
exa,arcade_bar,Throwback Tuesdays (NQ64 Soho),,https://www.designmynight.com/london/bars/soho/nq64-soho/throwback-tuesdays-nq64-soho,,,,,,,,
exa,arcade_bar,Retro Gaming & Arcade Bar in London Soho - NQ64,,https://nq64.co.uk/soho/,,,,,,,,
exa,arcade_bar,Retro Gaming & Arcade Bar in Shoreditch London - NQ64,,https://nq64.co.uk/shoreditch/,,,,,,,,
exa,arcade_bar,NQ64 | Drinks,,https://nq64.co.uk/shoreditch/drinks/,,,,,,,,
exa,arcade_bar,Best Arcades In The UK - DesignMyNight,,https://www.designmynight.com/uk/best-arcades-uk,,,,,,,,
exa,arcade_bar,"NQ64 | Game, Activity & Arcade Bar Across the UK",,https://nq64.co.uk/,,,,,,,,
exa,roller_skating,Where To Go Roller Skating In London | DesignMyNight,,https://www.designmynight.com/london/roller-skating-london,,,,,,,,
exa,roller_skating,"QUEENS Skate Dine Bowl | Things to do in Queensway, London",,https://www.timeout.com/london/things-to-do/queens-skate-dine-bowl,,,,,,,,
exa,roller_skating,"Roller Nation | Nightlife in Tottenham, London - Time Out",,https://www.timeout.com/london/nightlife/roller-nation,,,,,,,,
exa,roller_skating,Roller Nation: Fun Tottenham Bar DesignMyNight,,https://www.designmynight.com/london/bars/north-london/roller-nation,,,,,,,,
exa,roller_skating,Flipper's Roller Boogie Palace - London - DesignMyNight,,https://www.designmynight.com/london/bars/west-london/flippers-roller-boogie-palace,,,,,,,,
exa,roller_skating,"Flippers Roller Boogie Palace | Things to do in White City, London",,https://www.timeout.com/london/things-to-do/flippers-roller-boogie-palace,,,,,,,,
exa,roller_skating,"Rollernation | Things to do in Tottenham, London - Time Out",,https://www.timeout.com/london/things-to-do/rollernation,,,,,,,,
exa,roller_skating,London is getting the UK's first immersive roller-skating rink - Time Out,,https://www.timeout.com/london/news/london-is-getting-the-uks-first-immersive-roller-skating-rink-111423,,,,,,,,
exa,roller_skating,This legendary American rollerskating rink is opening in London next month,,https://www.timeout.com/london/news/this-legendary-us-rollerskating-rink-is-opening-in-london-next-month-102822?cid=~london~natsoc~twitter~echobox,,,,,,,,
exa,roller_skating,How London Embraced Rollerskating,,https://www.timeout.com/london/things-to-do/how-london-embraced-rollerskating,,,,,,,,
osm,amusement_arcade,The Heart of Gaming,,https://www.heartofgaming.co.uk/,CR0 1UG,51.3753711,-0.1009464,,,,,
osm,amusement_arcade,Novelty Automation,,https://novelty-automation.com/,WC1R 4AX,51.5197601,-0.1165252,,,,,
osm,amusement_arcade,Gravity Max,,https://gravity-global.com/max/wandsworth,SW18 4TF,51.4560672,-0.1933351,,,,,
osm,amusement_arcade,Las Vegas Arcade,,https://www.lasvegasarcadesoho.co.uk/,,51.5126831,-0.1335662,,,,,
osm,amusement_arcade,Flip Out London,,,CR0 4AA,51.3710622,-0.1230054,,,,,
osm,amusement_arcade,Admiral Slots Gaming Online,Admiral,https://www.admiralslots.co.uk/venues/west-ealing/,,51.5104026,-0.3235998,,,,,
osm,amusement_arcade,NQ64,,https://nq64.co.uk/soho,W1F 8SP,51.5155639,-0.1363857,,,,,
osm,amusement_arcade,Golden Slots,,,N4 1AG,51.579181,-0.0989044,,,,,
osm,amusement_arcade,Four Quarters,Four Quarters,https://fourquarters.bar/location/elephant-castle-arcade-bar/,SE17 1AZ,51.4934121,-0.0951789,,,,,
osm,amusement_arcade,DNA VR,,https://www.dnavr.co.uk/,N7 9LR,51.5486695,-0.1283558,,,,,
osm,amusement_arcade,Merkur Slots,,,W13 9DA,51.5102746,-0.3227898,,,,,
osm,amusement_arcade,Laser Quest Romford,,https://laserquestromford.com,RM1 1JL,51.5768833,0.177858,,,,,
osm,amusement_arcade,Boom Battle Bar,,,,51.5120454,-0.3064028,,,,,
osm,amusement_arcade,New Meta,,https://playnewmeta.gg/,,51.5384505,-0.103236,,,,,
osm,amusement_arcade,Sandbox VR,,https://sandboxvr.com/,,51.516517,-0.1243807,,,,,
osm,amusement_arcade,Fairgame,,https://www.wearefairgame.com/,E14 4DH,51.506113,-0.0221117,,,,,
osm,amusement_arcade,Cashino,,,,51.5114568,-0.3760256,,,,,
osm,amusement_arcade,Babylon Park,,https://www.babylonpark.com/,,51.5422144,-0.14498,,,,,
osm,amusement_arcade,Reels Casino Slots,,,,51.5139386,-0.4732366,,,,,
osm,amusement_arcade,Immersive Gamebox,,https://immersivegamebox.com/locations/southbank-london/,SE1 0XN,51.5042342,-0.1034685,,,,,
osm,amusement_arcade,Agora Gaming,,,,51.5363556,-0.2481922,,,,,
osm,amusement_arcade,Four Quarters,Four Quarters,https://fourquarters.bar/location/arcade-bar-south-london/,SE15 4TP,51.4680069,-0.0670145,,,,,
osm,amusement_arcade,FreePlayCity,,https://freeplaycity.com/,N4 1DN,51.5754113,-0.0877368,,,,,
osm,amusement_arcade,Palace Amusements,,,CR0 1TG,51.3752243,-0.1013765,,,,,
osm,amusement_arcade,Reel Time,,https://citikey.uk/display/reel-time-DTRHV,W2 1DH,51.518524,-0.1675984,,,,,
osm,amusement_arcade,Silver Time,,,,51.5538616,-0.2935976,,,,,
osm,amusement_arcade,Funland,,,,51.5243158,-0.1235314,,,,,
osm,amusement_arcade,Voyager,,,,51.4712372,-0.4585112,,,,,
osm,amusement_arcade,Otherworld,,https://www.other.world,,51.5370688,-0.0756567,,,,,
osm,amusement_arcade,Four Quarters,Four Quarters,https://fourquarters.bar,E15 2GW,51.5469335,-0.0240769,,,,,
osm,amusement_arcade,Showman Amusements,,,E15 4PH,51.5407311,0.0022081,,,,,
osm,amusement_arcade,Virgin Media Gamepad,,https://home.virginmedia.com/virgin-tv-edit/tips-and-tricks/virgin-media-gamepad,,51.5022475,0.0035547,,,,,
osm,amusement_arcade,Gravity Max,,,E20 1GL,51.5421094,-0.0068512,,,,,
osm,amusement_arcade,F1 Box,,,,51.5434643,-0.0066862,,,,,
osm,trampoline,Oxygen Freejumping,,https://oxygenfreejumping.co.uk/locations/croydon/,CR0 4RQ,51.3567611,-0.1144809,,,,,
osm,trampoline,Flip Out,Flip Out,https://www.flipout.co.uk/locations/london-e6,E6 1LB,51.5326252,0.050872,,,,,
osm,trampoline,Oxygen Freejumping,,,W3 0AF,51.5215668,-0.2770295,,,,,
osm,trampoline,,,,,51.5391567,-0.3914472,,,,,
osm,trampoline,Zap Space,,https://zapspace.co.uk/,E15 4QZ,51.5385751,-0.0008154,,,,,
osm,climbing,Boulder (Mabley Green),,https://www.peeruk.org/chrisdorleybrownjohnfrankland,,51.5489644,-0.032624,,,,,
osm,climbing,Outdoor climbing wall,,,,51.4404062,-0.0631736,,,,,
osm,climbing,,,,,51.5383726,-0.2150862,,,,,
osm,climbing,,,,,51.4308063,-0.0657487,,,,,
osm,climbing,BethWall Climbing Centre,,https://londonclimbingcentres.co.uk/centre/bethwall/,E2 9QX,51.5277422,-0.056381,,,,,
osm,climbing,Boulder (Shoreditch Park),,https://www.peeruk.org/chrisdorleybrownjohnfrankland,,51.5344721,-0.0867204,,,,,
osm,climbing,Harrowall,,https://londonclimbingcentres.co.uk/centre/harrowall/,HA1 4HX,51.5806563,-0.3443853,,,,,
osm,climbing,Croywall,,https://londonclimbingcentres.co.uk/centre/croywall/,CR0 4WN,51.3741559,-0.1155061,,,,,
osm,climbing,Yonder Climbing,,https://www.thisisyonder.com/yonder-climbing-new,E17 6DP,51.5896021,-0.0409418,,,,,
osm,climbing,Stronghold London Fields,,https://www.thestrongholduk.com/locations/london-fields/,E8 4FX,51.5346509,-0.0603288,,,,,
osm,climbing,City Bouldering,,https://www.citybouldering.co.uk/,EC3N 1AH,51.5143877,-0.074975,,,,,
osm,climbing,,,,,51.4414572,0.0131597,,,,,
osm,climbing,,,,,51.4414458,0.0133422,,,,,
osm,climbing,Canary Wall,,https://londonclimbingcentres.co.uk/centre/canarywall/,E14 8AA,51.5096695,-0.0273713,,,,,
osm,climbing,Stronghold Tottenham Hale,,https://thestrongholduk.com/locations/tottenham-hale/,N15 4BE,51.5854474,-0.0607538,,,,,
osm,climbing,Rise Climbing,,https://www.rise-climbing.com/,E16 1ZA,51.511188,0.0127298,,,,,
osm,climbing,Hang,,,TW3 1EH,51.4705329,-0.361877,,,,,
osm,climbing,EustonWall Climbing Centre,,https://londonclimbingcentres.co.uk/centre/eustonwall/,NW1 3AX,51.5246047,-0.1418928,,,,,
osm,climbing,The Arch Climbing Wall Surrey Quays,,https://www.archclimbingwall.com/surrey-quays-centre,SE16 7LL,51.4955073,-0.0472809,,,,,
osm,climbing,The Font Borough,,https://www.the-font.co.uk/borough,SE1 9BL,51.5071808,-0.0971764,,,,,
osm,climbing,City Bouldering,,,,51.5094954,-0.2229755,,,,,
osm,climbing,Blocfit,,,SW9 8RR,51.4650031,-0.1028668,,,,,
osm,climbing,Canary Wall,,,E14 8AB,51.509725,-0.0274909,,,,,
osm,climbing,Canary Wall,,,E14 8AB,51.5095715,-0.0271245,,,,,
osm,climbing,Romford Rock and Boulder,,https://www.romfordrockandboulder.co.uk/,,51.5829803,0.1745672,,,,,
